sic03,SIC03_DESCRIPTION
64200,Telecommunications
64200,Telecommunications
72210,Publishing of software
72220,Other software consultancy and supply
72400,Database activities
72210,Publishing of software
72220,Other software consultancy and supply
72400,Database activities
72100,Hardware consultancy
72220,Other software consultancy and supply
72300,Data processing
30020,Manufacture of computers and other information processing equipment
72220,Other software consultancy and supply
72600,Other computer related activities
72300,Data processing
72400,Database activities
72400,Database activities
92400,News agency activities
74879,Other business activities not elsewhere classified
65110,Central banking
65121,Banks
65122,Building societies
74159,Management activities of other non-financial holding companies
74158,Management activities of production holding companies
74153,Management activities of construction holding companies
74151,Management activities of wholesale holding companies
74155,Management activities of motor trades holding companies
74157,Management activities of retail holding companies
65234,Activities of bank holding companies
65239,Financial intermediation not elsewhere classified
74152,Management activities of transport holding companies
74154,Management activities of catering holding companies
74156,Management activities of service trades holding companies
74159,Management activities of other non-financial holding companies
65231,Activities of investment trusts
65232,Activities of unit trusts
65235,Activities of venture and development capital companies
65237,Activities of open-ended investment companies
65238,Activities of property unit trusts
65231,Activities of investment trusts
65210,Financial leasing
65221,Credit granting by non-deposit taking finance houses and other specialist consumer credit grantors
65223,Activities of mortgage finance companies
65229,Other credit granting not elsewhere classified
65233,Security dealing on own account
65222,Factoring
65239,Financial intermediation not elsewhere classified
66011,Life insurance
66031,Non-life insurance
66012,Life re-insurance
66020,Pension funding
66032,Non-life re-insurance
66020,Pension funding
67110,Administration of financial markets
67122,Security broking and fund management
67130,Activities auxiliary to financial intermediation n.e.c.
67130,Activities auxiliary to financial intermediation n.e.c.
67200,Activities auxiliary to insurance and pension funding
67200,Activities auxiliary to insurance and pension funding
67200,Activities auxiliary to insurance and pension funding
67121,Fund management activities
70120,Buying and selling of own real estate
70209,Other letting of own property
70201,Letting of conference and exhibition centres
70209,Other letting of own property
70310,Real estate agencies
70320,Management of real estate on a fee or contract basis
74112,Barristers at law
74113,Solicitors
74111,Activities of patent and copyright agents
74119,Other legal activities not elsewhere classified
74121,Accounting and auditing activities
74122,Book-keeping activities
74123,Tax consultancy
74151,Management activities of wholesale holding companies
74152,Management activities of transport holding companies
74153,Management activities of construction holding companies
74154,Management activities of catering holding companies
74155,Management activities of motor trades holding companies
74156,Management activities of service trades holding companies
74157,Management activities of retail holding companies
74158,Management activities of production holding companies
74159,Management activities of other non-financial holding companies
74141,Public relations activities
74142,Financial management
05010,Fishing
74143,General management consultancy activities
74149,"Business and management consultancy activities, n.e.c."
74201,Architectural activities
74202,Urban planning and landscape architectural activities
74205,Engineering design activities for industrial process and production
74206,Engineering related scientific and technical consulting activities
74204,Engineering consultative and design activities
74209,Other engineering activities
74300,Technical testing and analysis
73100,Research and experimental development on natural sciences and engineering
73100,Research and experimental development on natural sciences and engineering
73100,Research and experimental development on natural sciences and engineering
73200,Research and experimental development on social sciences and humanities
74402,"Planning, creation and placement of advertising activities"
74409,Advertising activities not elsewhere classified
74401,Sale or leasing activities of advertising space or time
74130,Market research and public opinion polling
74872,Specialty design activities
74812,Portrait photographic activities
74206,Engineering related scientific and technical consulting activities
74813,Other specialist photography
74814,Film processing
74819,Photographic activities not elsewhere classified
92400,News agency activities
74850,Secretarial and translation activities
74206,Engineering related scientific and technical consulting activities
74203,Quantity surveying activities
63400,Activities of other transport agencies
74149,"Business and management consultancy activities, n.e.c."
74206,Engineering related scientific and technical consulting activities
74602,Security and related activities
74879,Other business activities not elsewhere classified
85200,Veterinary activities
71100,Renting of automobiles
71219,Renting of other land transport equipment
71401,Renting of sporting and recreational equipment
71404,Renting of records and other pre-recorded media
71405,Renting of video tapes and DVDs
71403,"Renting of radios, televisions and video recorders and DVD players"
71401,Renting of sporting and recreational equipment
71409,Renting of other personal and household goods not elsewhere classified
71310,Renting of agricultural machinery and equipment
71320,Renting of construction and civil engineering machinery and equipment
71330,"Renting of office machinery and equipment, including computers"
71221,Renting of passenger water transport equipment
71229,Renting of other water transport equipment
71231,Renting of passenger air transport equipment
71239,Renting of other air transport equipment
71211,Renting of passenger land transport equipment
71219,Renting of other land transport equipment
71320,Renting of construction and civil engineering machinery and equipment
71340,Renting of other machinery and equipment n.e.c.
74879,Other business activities not elsewhere classified
74500,Labour recruitment and provision of personnel
92721,"Motion picture, television and other theatrical casting"
74500,Labour recruitment and provision of personnel
74500,Labour recruitment and provision of personnel
74500,Labour recruitment and provision of personnel
63301,Activities of travel agencies
63302,Activities of travel organisers
63303,Activities of tour guides
63309,Other tourist assistance activities n.e.c.
92320,Operation of arts facilities
92349,Other entertainment activities not elsewhere classified
92629,Other sporting activities not elsewhere classified
92729,Other recreational activities not elsewhere classified
74602,Security and related activities
45310,Installation of electrical wiring and fittings
74602,Security and related activities
74601,Investigation activities
70320,Management of real estate on a fee or contract basis
75140,Supporting service activities for the government as a whole
74701,Traditional cleaning services
74702,Window cleaning services
74704,Specialised cleaning services
74705,Furnace and chimney cleaning services
74709,Cleaning activities not elsewhere classified
74703,Disinfecting and exterminating services
74709,Cleaning activities not elsewhere classified
90030,"Sanitation, remediation and similar activities"
01410,Agricultural service activities; landscape gardening
74850,Secretarial and translation activities
64110,National post activities
74850,Secretarial and translation activities
74860,Call centre activities
74873,Activities of exhibition and fair organisers
74874,Activities of conference organisers
74871,Credit reporting and collection agency activities 
74871,Credit reporting and collection agency activities 
74820,Packaging activities
74850,Secretarial and translation activities
74879,Other business activities not elsewhere classified
75130,Regulation of and contribution to more efficient operation of business
75110,General (overall) public service activities
75140,Supporting service activities for the government as a whole
75120,"Regulation of the activities of agencies that provide health care, education, cultural services and other social services, excluding social security"
75130,Regulation of and contribution to more efficient operation of business
75210,Foreign affairs
75220,Defence activities
75230,Justice and judicial activities
75240,"Public security, law and order activities"
75250,Fire service activities
75300,Compulsory social security activities
80100,Primary education
80100,Primary education
80210,General secondary education
63220,Other supporting water transport activities
63230,Other supporting air transport activities
80220,Technical and vocational secondary education
80429,Other adult and other education n.e.c.
80301,Sub-degree level higher education 
80302,First-degree level higher education
80303,Post-graduate level higher education
80429,Other adult and other education n.e.c.
92629,Other sporting activities not elsewhere classified
93059,Other service activities n.e.c.
80429,Other adult and other education n.e.c.
92341,Dance halls and dancing instructor activities
80410,Driving school activities
80421,Activities of private training providers
80429,Other adult and other education n.e.c.
74143,General management consultancy activities
85111,"Public sector hospital activities, including NHS trusts"
85112,Private sector hospital activities
85113,Medical nursing home activities
85120,Medical practice activities
85120,Medical practice activities
85130,Dental practice activities
85140,Other human health activities
85140,Other human health activities
85111,"Public sector hospital activities, including NHS trusts"
85112,Private sector hospital activities
85140,Other human health activities
85311,Charitable social work activities with accommodation
85312,Non-charitable social work activities with accommodation
85140,Other human health activities
85311,Charitable social work activities with accommodation
85312,Non-charitable social work activities with accommodation
85311,Charitable social work activities with accommodation
85312,Non-charitable social work activities with accommodation
85321,Charitable social work activities without accommodation
85322,Non-charitable social work activities without accommodation
85321,Charitable social work activities without accommodation
85322,Non-charitable social work activities without accommodation
75210,Foreign affairs
85321,Charitable social work activities without accommodation
85322,Non-charitable social work activities without accommodation
92311,Live theatrical presentations
92319,Other artistic and literary creation and interpretation
92349,Other entertainment activities not elsewhere classified
92311,Live theatrical presentations
92320,Operation of arts facilities
92349,Other entertainment activities not elsewhere classified
92319,Other artistic and literary creation and interpretation
92400,News agency activities
92320,Operation of arts facilities
92510,Library and archives activities
75140,Supporting service activities for the government as a whole
92510,Library and archives activities
92521,Museums activities
92522,Preservation of historical sites and buildings
92530,Botanical and zoological gardens and nature reserves activities
92710,Gambling and betting activities
92611,Operation of ice rinks and roller skating rinks
92619,Operation of other sports arenas and stadiums not elsewhere classified
92629,Other sporting activities not elsewhere classified
92629,Other sporting activities not elsewhere classified
93040,Physical well-being activities
92621,Activities of racehorse owners
92629,Other sporting activities not elsewhere classified
92330,Fair and amusement park activities
92330,Fair and amusement park activities
92341,Dance halls and dancing instructor activities
92349,Other entertainment activities not elsewhere classified
92629,Other sporting activities not elsewhere classified
92729,Other recreational activities not elsewhere classified
91110,Activities of business and employers' organizations
91120,Activities of professional organizations
91200,Activities of trade unions
91310,Activities of religious organizations
91320,Activities of political organizations
01500,"Hunting, trapping and game propagation, including related service activities"
91330,Activities of other membership organizations n.e.c.
72500,"Maintenance and repair of office, accounting and computing machinery"
32201,Manufacture of telegraph and telephone apparatus and equipment  
32202,Manufacture of radio and electronic capital goods
32300,"Manufacture of television and radio receivers, sound or video recording or reproducing apparatus and associated goods"
52740,Repair n.e.c.
52720,Repair of electrical household goods
29320,Manufacture of other agricultural and forestry machinery
52720,Repair of electrical household goods
52740,Repair n.e.c.
52710,"Repair of boots, shoes and other articles of leather"
52740,Repair n.e.c.
36110,Manufacture of chairs and seats
36120,Manufacture of other office and shop furniture
36130,Manufacture of other kitchen furniture
36140,Manufacture of other furniture
36150,Manufacture of mattresses
52730,"Repair of watches, clocks and jewellery"
17402,"Manufacture of canvas goods, sacks, etc."
36300,Manufacture of musical instruments
52740,Repair n.e.c.
93010,Washing and dry-cleaning of textile and fur products
93020,Hairdressing and other beauty treatment
93030,Funeral and related activities
93040,Physical well-being activities
52740,Repair n.e.c.
93051,Operation of coin-operated photographic machines
93059,Other service activities n.e.c.
95000,Activities of households as employers of domestic staff
96000,Undifferentiated goods producing activities of private households for own use
97000,Undifferentiated services producing activities of private households for own use
99000,Extra-territorial organizations and bodies
