sic03,SIC03_DESCRIPTION
36501,Manufacture of professional and arcade games and toys
36509,"Manufacture of other games and toys, n.e.c."
17403,Manufacture of household textiles
24422,Manufacture of non-medicaments
25130,Manufacture of other rubber products
29240,Manufacture of other general purpose machinery n.e.c.
33100,Manufacture of medical and surgical equipment and orthopaedic appliances
33201,"Manufacture of electronic instruments and appliances for measuring, checking, testing, navigating and other purposes, except industrial process control equipment"
33401,Manufacture of spectacles and unmounted lenses
36620,Manufacture of brooms and brushes
18100,Manufacture of leather clothes
18241,Manufacture of hats
18243,"Cut, make and trim for clothing manufacturers"
18249,Manufacture of other wearing apparel and accessories n.e.c.
19200,"Manufacture of luggage, handbags and the like, saddlery and harness"
20510,Manufacture of other products of wood
20520,"Manufacture of articles of cork, straw and plaiting materials"
22110,Publishing of books
25130,Manufacture of other rubber products
25240,Manufacture of other plastic products
28750,Manufacture of other fabricated metal products n.e.c.
33100,Manufacture of medical and surgical equipment and orthopaedic appliances
36400,Manufacture of sports goods
36631,Manufacture of miscellaneous stationers' goods
36639,Other manufacturing n.e.c.
28110,Manufacture of metal structures and parts of structures
28210,"Manufacture of tanks, reservoirs and containers of metal"
28220,Manufacture of central heating radiators and boilers
28300,"Manufacture of steam generators, except central heating hot water boilers"
28610,Manufacture of cutlery
28620,Manufacture of tools
28630,Manufacture of locks and hinges
28710,Manufacture of steel drums and similar containers
28750,Manufacture of other fabricated metal products n.e.c.
29600,Manufacture of weapons and ammunition
34202,Manufacture of trailers and semi-trailers
35500,Manufacture of other transport equipment n.e.c.
28520,General mechanical engineering
29110,"Manufacture of engines and turbines, except aircraft, vehicle and cycle engines"
29121,Manufacture of pumps
29122,Manufacture of compressors
29130,Manufacture of taps and valves
29140,"Manufacture of bearings, gears, gearing and driving elements"
29210,Manufacture of furnaces and furnace burners
29220,Manufacture of lifting and handling equipment
29230,Manufacture of non-domestic cooling and ventilation equipment
29240,Manufacture of other general purpose machinery n.e.c.
29310,Manufacture of agricultural tractors
29320,Manufacture of other agricultural and forestry machinery
29410,Manufacture of portable hand held power tools
29420,Manufacture of other metalworking machine tools
29430,Manufacture of other machine tools n.e.c.
29510,Manufacture of machinery for metallurgy
29521,Manufacture of machinery for mining
29522,Manufacture of earthmoving equipment
29523,Manufacture of equipment for concrete crushing and screening and roadworks
29530,"Manufacture of machinery for food, beverage and tobacco processing"
29540,"Manufacture of machinery for textile, apparel and leather production"
29550,Manufacture of machinery for paper and paperboard production
29560,Manufacture of other special purpose machinery n.e.c.
72500,"Maintenance and repair of office, accounting and computing machinery"
29240,Manufacture of other general purpose machinery n.e.c.
31100,"Manufacture of electric motors, generators and transformers"
31620,Manufacture of other electrical equipment n.e.c.
32100,Manufacture of electronic valves and tubes and other electronic components
32300,"Manufacture of television and radio receivers, sound or video recording or reproducing apparatus and associated goods"
33100,Manufacture of medical and surgical equipment and orthopaedic appliances
33201,"Manufacture of electronic instruments and appliances for measuring, checking, testing, navigating and other purposes, except industrial process control equipment"
33401,Manufacture of spectacles and unmounted lenses
33402,Manufacture of optical precision instruments
33403,Manufacture of photographic and cinematographic equipment
33500,Manufacture of watches and clocks
29710,Manufacture of electric domestic appliances
31100,"Manufacture of electric motors, generators and transformers"
31200,Manufacture of electricity distribution and control apparatus
31400,"Manufacture of accumulators, primary cells and primary batteries"
31500,Manufacture of lighting equipment and electric lamps
31620,Manufacture of other electrical equipment n.e.c.
33100,Manufacture of medical and surgical equipment and orthopaedic appliances
33202,"Manufacture of non-electronic instruments and appliances for measuring, checking, testing, navigating and other purposes, except industrial process control equipment"
35110,Building and repairing of ships
35120,Building and repairing of pleasure and sporting boats
35300,Manufacture of aircraft and spacecraft
34202,Manufacture of trailers and semi-trailers
34203,Manufacture of caravans
35200,Manufacture of railway and tramway locomotives and rolling stock
35430,Manufacture of invalid carriages
35500,Manufacture of other transport equipment n.e.c.
17402,"Manufacture of canvas goods, sacks, etc."
17520,"Manufacture of cordage, rope, twine and netting"
20400,Manufacture of wooden containers
20510,Manufacture of other products of wood
25130,Manufacture of other rubber products
25210,"Manufacture of plastic plates, sheets, tubes and profiles"
25240,Manufacture of other plastic products
26150,"Manufacture and processing of other glass, including technical glassware"
26400,"Manufacture of bricks, tiles and construction products, in baked clay"
26810,Production of abrasive products
36300,Manufacture of musical instruments
36501,Manufacture of professional and arcade games and toys
25210,"Manufacture of plastic plates, sheets, tubes and profiles"
26150,"Manufacture and processing of other glass, including technical glassware"
26400,"Manufacture of bricks, tiles and construction products, in baked clay"
26810,Production of abrasive products
28110,Manufacture of metal structures and parts of structures
28210,"Manufacture of tanks, reservoirs and containers of metal"
28220,Manufacture of central heating radiators and boilers
28300,"Manufacture of steam generators, except central heating hot water boilers"
28520,General mechanical engineering
28620,Manufacture of tools
28630,Manufacture of locks and hinges
28710,Manufacture of steel drums and similar containers
28730,Manufacture of wire products
28740,"Manufacture of fasteners, screw machine products, chain and springs"
28750,Manufacture of other fabricated metal products n.e.c.
29110,"Manufacture of engines and turbines, except aircraft, vehicle and cycle engines"
29121,Manufacture of pumps
29122,Manufacture of compressors
29130,Manufacture of taps and valves
29140,"Manufacture of bearings, gears, gearing and driving elements"
29210,Manufacture of furnaces and furnace burners
29220,Manufacture of lifting and handling equipment
29230,Manufacture of non-domestic cooling and ventilation equipment
29240,Manufacture of other general purpose machinery n.e.c.
29320,Manufacture of other agricultural and forestry machinery
29420,Manufacture of other metalworking machine tools
29430,Manufacture of other machine tools n.e.c.
29510,Manufacture of machinery for metallurgy
29521,Manufacture of machinery for mining
29522,Manufacture of earthmoving equipment
29523,Manufacture of equipment for concrete crushing and screening and roadworks
29530,"Manufacture of machinery for food, beverage and tobacco processing"
29540,"Manufacture of machinery for textile, apparel and leather production"
29550,Manufacture of machinery for paper and paperboard production
29560,Manufacture of other special purpose machinery n.e.c.
29600,Manufacture of weapons and ammunition
30010,Manufacture of office machinery
30020,Manufacture of computers and other information processing equipment
31100,"Manufacture of electric motors, generators and transformers"
31200,Manufacture of electricity distribution and control apparatus
31300,Manufacture of insulated wire and cable
31400,"Manufacture of accumulators, primary cells and primary batteries"
31500,Manufacture of lighting equipment and electric lamps
31610,Manufacture of electrical equipment for engines and vehicles n.e.c.
31620,Manufacture of other electrical equipment n.e.c.
32100,Manufacture of electronic valves and tubes and other electronic components
32201,Manufacture of telegraph and telephone apparatus and equipment  
32202,Manufacture of radio and electronic capital goods
32300,"Manufacture of television and radio receivers, sound or video recording or reproducing apparatus and associated goods"
33100,Manufacture of medical and surgical equipment and orthopaedic appliances
33201,"Manufacture of electronic instruments and appliances for measuring, checking, testing, navigating and other purposes, except industrial process control equipment"
33202,"Manufacture of non-electronic instruments and appliances for measuring, checking, testing, navigating and other purposes, except industrial process control equipment"
33301,Manufacture of electronic industrial process control equipment
33302,Manufacture of non-electronic industrial process control equipment
33401,Manufacture of spectacles and unmounted lenses
33402,Manufacture of optical precision instruments
33403,Manufacture of photographic and cinematographic equipment
33500,Manufacture of watches and clocks
34100,Manufacture of motor vehicles
35110,Building and repairing of ships
36110,Manufacture of chairs and seats
36501,Manufacture of professional and arcade games and toys
40110,Production of electricity
40120,Transmission of electricity
40130,Distribution and trade of electricity
40130,Distribution and trade of electricity
40210,Manufacture of gas
40220,Distribution and trade of gaseous fuels through mains
40220,Distribution and trade of gaseous fuels through mains
40300,Steam and hot water supply
41000,"Collection, purification and distribution of water"
90010,Collection and treatment of sewage
90020,Collection and treatment of other waste
90030,"Sanitation, remediation and similar activities"
23300,Processing of nuclear fuel
40110,Production of electricity
90020,Collection and treatment of other waste
14500,Other mining and quarrying n.e.c.
24150,Manufacture of fertilizers and nitrogen compounds
90020,Collection and treatment of other waste
23300,Processing of nuclear fuel
90020,Collection and treatment of other waste
37100,Recycling of metal waste and scrap
37100,Recycling of metal waste and scrap
37200,Recycling of non-metal waste and scrap
90030,"Sanitation, remediation and similar activities"
70110,Development and selling of real estate
20300,Manufacture of builders' carpentry and joinery
25239,Manufacture of other builders' ware of plastic
28110,Manufacture of metal structures and parts of structures
45211,Construction of commercial buildings
45230,"Construction of motorways, roads, airfields and sport facilities"
20300,Manufacture of builders' carpentry and joinery
25239,Manufacture of other builders' ware of plastic
28110,Manufacture of metal structures and parts of structures
45212,Construction of domestic buildings
45230,"Construction of motorways, roads, airfields and sport facilities"
45230,"Construction of motorways, roads, airfields and sport facilities"
45213,Construction of civil engineering constructions
45230,"Construction of motorways, roads, airfields and sport facilities"
45213,Construction of civil engineering constructions
45213,Construction of civil engineering constructions
45240,Construction of water projects
45250,Other construction work involving special trades
45213,Construction of civil engineering constructions
45240,Construction of water projects
45213,Construction of civil engineering constructions
45230,"Construction of motorways, roads, airfields and sport facilities"
45110,Demolition and wrecking of buildings; earth moving
45110,Demolition and wrecking of buildings; earth moving
45120,Test drilling and boring
45310,Installation of electrical wiring and fittings
45340,Other building installation
28220,Manufacture of central heating radiators and boilers
45310,Installation of electrical wiring and fittings
45330,Plumbing
29220,Manufacture of lifting and handling equipment
45310,Installation of electrical wiring and fittings
45320,Insulation work activities
45340,Other building installation
45410,Plastering
20300,Manufacture of builders' carpentry and joinery
25239,Manufacture of other builders' ware of plastic
28120,Manufacture of builders' carpentry and joinery of metal
45420,Joinery installation
45430,Floor and wall covering
45440,Painting and glazing
45440,Painting and glazing
45450,Other building completion
20300,Manufacture of builders' carpentry and joinery
45220,Erection of roof covering and frames
45250,Other construction work involving special trades
45211,Construction of commercial buildings
45220,Erection of roof covering and frames
45240,Construction of water projects
45250,Other construction work involving special trades
45450,Other building completion
45500,Renting of construction or demolition equipment with operator
50101,Sale of new motor vehicles
50102,Sale of used motor vehicles
50101,Sale of  new motor vehicles
50102,Sale of used motor vehicles
50200,Maintenance and repair of motor vehicles
50300,Sale of motor vehicle parts and accessories
50300,Sale of motor vehicle parts and accessories
50400,"Sale, maintenance and repair of motorcycles and related parts and accessories"
51110,"Agents involved in the sale of agricultural raw materials, live animals, textile raw materials and semi-finished goods"
51120,"Agents involved in the sale of fuels, ores, metals and industrial chemicals"
51130,Agents involved in the sale of timber and building materials
51140,"Agents involved in the sale of machinery, industrial equipment, ships and aircraft"
51150,"Agents involved in the sale of furniture, household goods, hardware and ironmongery"
51160,"Agents involved in the sale of textiles, clothing, footwear and leather goods"
51170,"Agents involved in the sale of food, beverages and tobacco"
51180,Agents specializing in the sale of particular products or ranges of products n.e.c.
51190,Agents involved in the sale of a variety of goods
51210,"Wholesale of grain, seeds and animal feeds"
51250,Wholesale of unmanufactured tobacco
51220,Wholesale of flowers and plants
51230,Wholesale of live animals
51241,Wholesale of furskins
51249,"Wholesale of hides, skins and leather n.e.c."
51310,Wholesale of fruit and vegetables
51380,"Wholesale of other food, including fish, crustaceans and molluscs"
51320,Wholesale of meat and meat products
51331,Wholesale of dairy produce
51332,Wholesale of eggs
51333,Wholesale of edible oils and fats
51341,"Wholesale of fruit and vegetable juices, mineral water and soft drinks"
51342,"Wholesale of wine, beer, spirits and other alcoholic beverages"
51350,Wholesale of tobacco products
51360,Wholesale of sugar and chocolate and sugar confectionery
51370,"Wholesale of coffee, tea, cocoa and spices"
51380,"Wholesale of other food, including fish, crustaceans and molluscs"
51390,"Non-specialised wholesale of food, beverages and tobacco"
51410,Wholesale of textiles
51421,Wholesale of adults' fur and leather clothing
51422,Wholesale of children's and infants' clothing
51423,Wholesale of footwear
51429,Wholesale of clothing n.e.c.
51431,"Wholesale of gramophone records, audio tapes, compact discs and video tapes and of the equipment on which these are played"
51439,Wholesale of radios and televisions; wholesale of electrical household appliances n.e.c.
51476,Wholesale of photographic goods
51479,Wholesale of other household goods n.e.c.
51440,"Wholesale of china and glassware, wallpaper and cleaning materials"
51450,Wholesale of perfume and cosmetics
51460,Wholesale of pharmaceutical goods
51439,Wholesale of electrical household appliances and radio and television goods
51471,Wholesale of furniture
51479,Wholesale of other household goods n.e.c.
51473,Wholesale of jewellery
51474,Wholesale of imitation jewellery
51479,Wholesale of other household goods n.e.c.
51475,Wholesale of musical instruments
51440,"Wholesale of china and glassware, wallpaper and cleaning materials"
51477,Wholesale of toys and games
51478,Wholesale of travel and fancy goods
51479,Wholesale of other household goods n.e.c.
51840,"Wholesale of computers, computer peripheral equipment and software"
51431,"Wholesale of gramophone records, audio tapes, compact discs and video tapes and of the equipment on which these are played"
51860,Wholesale of other electronic parts and equipment
51880,"Wholesale of agricultural machinery and accessories and implements, including tractors"
51810,Wholesale of machine tools
51820,"Wholesale of mining, construction and civil engineering machinery"
51830,Wholesale of machinery for the textile industry and of sewing and knitting machines
51850,Wholesale of other office machinery and equipment
51850,Wholesale of other office machinery and equipment
51870,"Wholesale of other machinery for use in industry, trade and navigation"
51511,Wholesale of petroleum and petroleum products
51519,Wholesale of other fuels and related products
51520,Wholesale of metals and metal ores
51440,"Wholesale of china and glassware, wallpaper and cleaning materials"
51479,Wholesale of other household goods n.e.c.
51530,"Wholesale of wood, construction materials and sanitary equipment"
51540,"Wholesale of hardware, plumbing and heating equipment and supplies"
51550,Wholesale of chemical products
51550,Wholesale of chemical products
51560,Wholesale of other intermediate products
51570,Wholesale of waste and scrap
51900,Other wholesale
52111,"Retail sale by confectioners, tobacconists and newsagents (CTNs)"
52112,"Retail sale in non-specialised stores holding an alcohol licence, with food, beverages or tobacco predominating"
52113,"Retail sale in non-specialised stores not holding an alcohol licence, with food, beverages or tobacco predominating"
52120,Other retail sale in non-specialised stores
52210,Retail sale of fruit and vegetables
52270,"Other retail sale of food, beverages and tobacco in specialised stores"
52220,Retail sale of meat and meat products
52230,"Retail sale of fish, crustaceans and molluscs"
52240,"Retail sale of bread, cakes, flour confectionery and sugar confectionery"
52250,Retail sale of alcoholic and other beverages
52260,Retail sale of tobacco products
52270,"Other retail sale of food, beverages and tobacco in specialised stores"
50500,Retail sale of automotive fuel
52482,"Retail sale of photographic, optical and precision equipment, office supplies and equipment (incl. computers)"
52485,"Retail sale of sports goods, games and toys, stamps and coins"
52488,Retail sale of mobile telephones
52482,"Retail sale of photographic, optical and precision equipment, office supplies and equipment (incl. computers)"
52450,Retail sale of electrical household appliances and radio and television goods
52410,Retail sale of textiles
52460,"Retail sale of hardware, paints and glass"
52440,"Retail sale of furniture, lighting equipment and household articles n.e.c."
52481,Retail sale of floor coverings
52489,Other retail sale in specialised stores n.e.c.
52450,Retail sale of electrical household appliances and radio and television goods
52450,Retail sale of electrical household appliances and radio and television goods
52440,"Retail sale of furniture, lighting equipment and household articles n.e.c."
52482,"Retail sale of photographic, optical and precision equipment, office supplies and equipment (incl. computers)"
52470,"Retail sale of books, newspapers and stationery"
52470,"Retail sale of books, newspapers and stationery"
52450,Retail sale of electrical household appliances and radio and television goods
52485,"Retail sale of sports goods, games and toys, stamps and coins"
52485,"Retail sale of sports goods, games and toys, stamps and coins"
52421,Retail sale of adults' fur and leather clothing
52422,Retail sale of children's and infants' clothing
52423,Retail sale of other women's clothing
52424,Retail sale of other men's clothing 
52431,Retail sale of footwear
52432,Retail sale of leather goods
52310,Dispensing chemists
52321,Retail sale of hearing aids
52329,Retail sale of medical and orthopaedic goods n.e.c.
52330,Retail sale of cosmetic and toilet articles
52489,Other retail sale  in specialised stores n.e.c.
52484,"Retail sale of jewellery, clocks and watches  "
52486,Retail sale in commercial art galleries
52487,Retail sale by opticians
52482,"Retail sale of photographic, optical and precision equipment, office supplies and equipment (incl. computers)"
52485,"Retail sale of sports goods, games and toys, stamps and coins"
52489,Other retail sale  in specialised stores n.e.c.
52501,"Retail sale of antiques, including antique books, in stores"
52630,Other non-store retail sale
52509,Retail sale of other second-hand goods in stores
52630,Other non-store retail sale
52620,Retail sale via stalls and markets
52620,Retail sale via stalls and markets
52620,Retail sale via stalls and markets
52610,Retail sale via mail order houses
52630,Other non-store retail sale
52630,Other non-store retail sale
60101,Inter-city services
60109,Other transport via railways
60109,Other transport via railways
60213,"Urban and suburban passenger railway transportation by underground, metro and similar systems"
60219,Other scheduled passenger land transport n.e.c.
60219,Other scheduled passenger land transport n.e.c.
60220,Taxi operation
60211,Inter-city coach service
60231,Renting of buses and coaches
60239,Other land passenger transport n.e.c.
60249,Freight transport by road n.e.c.
60241,Furniture removal activities
60300,Transport via pipelines
61101,Passenger sea and coastal water transport
61102,Freight sea and coastal water transport
61201,Passenger inland water transport
61209,Other inland water transport
62101,Scheduled passenger air transport
62201,Non-scheduled passenger air transport
62109,Other scheduled air transport
62209,Other non-scheduled air transport
62300,Space transport
63121,Storage and warehousing of frozen and refrigerated goods
63122,Storage and warehousing of liquids or gases
63123,Storage and warehousing of grain
63129,Storage and warehousing n.e.c.
63121,Storage and warehousing of frozen and refrigerated goods
63122,Storage and warehousing of liquids or gases
63123,Storage and warehousing of grain
63129,Storage and warehousing of n.e.c.
63121,Storage and warehousing of frozen and refrigerated goods
63122,Storage and warehousing of liquids or gases
63123,Storage and warehousing of grain
63129,Storage and warehousing of n.e.c.
63129,Storage and warehousing of n.e.c.
63210,Other supporting land transport activities
63210,Other supporting land transport activities
63210,Other supporting land transport activities
11100,Extraction of crude petroleum and natural gas
50200,Maintenance and repair of motor vehicles
60101,Inter-city services
60109,Other transport via railways
63210,Other supporting land transport activities
11100,Extraction of crude petroleum and natural gas
61101,Passenger sea and coastal water transport
61102,Freight sea and coastal water transport
61201,Passenger inland water transport
61209,Other inland water transport
63220,Other supporting water transport activities
62300,Space transport
63230,Other supporting air transport activities
63110,Cargo handling
63110,Cargo handling
63110,Cargo handling
63400,Activities of other transport agencies
64110,National post activities
64120,Courier activities other than national post activities
64120,Courier activities other than national post activities
55101,Hotels and motels with restaurant (licensed)
55102,Hotels and motels with restaurant (unlicensed)
55103,Hotels and motels without restaurant
55231,Holiday centres and holiday villages
55210,Youth hostels and mountain refuges
55232,Other self-catering holiday accommodation
55239,Other tourist or short-stay accommodation
55210,Youth hostels and mountain refuges
55220,"Camping sites, including caravan sites"
55239,Other tourist or short-stay accommodation
55301,Licensed restaurants
55302,Unlicensed restaurants and cafes
55303,Take-away food shops
55304,Take-away mobile food stands
55520,Catering
55510,Canteens
55520,Catering
55401,Licensed clubs
55402,Independent public houses and bars
55403,Tenanted public houses and bars
55404,Managed public houses and bars
22110,Publishing of books
72400,Database activities
22110,Publishing of books
72400,Database activities
22120,Publishing of newspapers
72400,Database activities
22130,Publishing of journals and periodicals
72400,Database activities
22130,Publishing of journals and periodicals
72400,Database activities
22150,Other publishing
22220,Other printing 
72400,Database activities
72210,Publishing of software
72400,Database activities
72210,Publishing of software
72400,Database activities
92111,Motion picture production on film or video
92111,Motion picture production on film or video
92111,Motion picture production on film or video
92202,Television activities
92119,Other motion picture and video production activities
92202,Television activities
92120,Motion picture and video distribution
92120,Motion picture and video distribution
92120,Motion picture and video distribution
92130,Motion picture projection
22140,Publishing of sound recordings
72400,Database activities
74879,Other business activities not elsewhere classified
92119,Other motion picture and video production activities
92201,Radio activities
64200,Telecommunications
72400,Database activities
92201,Radio activities
64200,Telecommunications
72400,Database activities
92202,Television activities
64200,Telecommunications
64200,Telecommunications
